{
  "schema_version": "1.0.0",
  "type": "telemetry",
  "timestamp": "2026-09-21T13:24:05Z",
  "session_id": "3f1b2c4d-5e6f-4a7b-8c9d-0e1f2a3b4c5d",
  "correlation_id": "req-0001",
  "payload": {
    "schema_version": "1.0.0",
    "device_id": "esp32-syncfit-01",
    "session_id": "3f1b2c4d-5e6f-4a7b-8c9d-0e1f2a3b4c5d",
    "timestamp": "2026-09-21T13:24:05Z",
    "modality": "MENSTRUAL_CYCLE",
    "day_or_week": 14,
    "biomarkers": {
      "delta_temperature_c": 0.42,
      "rmssd_hrv_ms": 28.5,
      "isometric_force_loss_pct": 12.8
    },
    "ppg_window": {
      "sample_rate_hz": 100,
      "window_size": 256,
      "samples": [721.5, 723.1, 725.0, 726.8, 728.2, 729.0, 728.4, 726.1]
    }
  }
}
